<?xml version="1.0" encoding="UTF-8"?>

<fox:films
        xmlns:xsi="http://www.w3.org/2001/XMLSchema-instance"
        xsi:noNamespaceSchemaLocation="FilmProvier.xsd"
        xmlns:fox="http://formationxml/filmprovider">

    <fox:realisateur id_realisateur="real_01">
        <fox:prenom>Tanguy</fox:prenom>
        <fox:nom>Fenouillot</fox:nom>
    </fox:realisateur>
    <fox:realisateur id_realisateur="real_02">
        <fox:prenom>Florian</fox:prenom>
        <fox:nom>Hyver</fox:nom>
    </fox:realisateur>

    <fox:film id_film="film_01" id_realisateur="real_01" annee="2001">
        <fox:titre>Film 1</fox:titre>
        <fox:resume>
            <fox:text>Lorem ipsum dolor sit amet, consectetur adipisicing elit. Aperiam, architecto aut consequatur culpa dolorem earum et fugiat harum id iure, molestiae molestias numquam? Culpa deserunt dolor maiores natus reprehenderit saepe.</fox:text>
        </fox:resume>
    </fox:film>
    <fox:film id_film="film_02" id_realisateur="real_02" annee="2003">
        <fox:titre>Film 2</fox:titre>
        <fox:resume>
            <fox:image source="killbill.jpg"/>
            <fox:text>Lorem ipsum dolor sit amet, consectetur adipisicing elit. Architecto, culpa delectus dignissimos doloremque, doloribus enim eos fugit ipsam itaque laborum maiores natus nihil pariatur quae sint sunt, temporibus voluptate voluptatum?</fox:text>
        </fox:resume>
    </fox:film>

</fox:films>
